paper_id,short_id,title,venue,year,conf_year,authors,abstract_raw,paper_link,arxiv_id,arxiv_url,keywords_raw,source_type,source_url,openreview_forum_id,has_pdf_camera_ready,state,filter_source,keyword_hits,embedding_score,ai_score,ai_reason,review_adjusted,review_adjust_reason,final_score,importance,core_or_edge,tags,topic_bucket,pdf_path,has_abstract,has_pdf_link,pdf_url,openreview_rating_mean,openreview_confidence_mean,openreview_decision,presentation_type,citation_count
ICCV_2025::7dgs_unified_spatial_temporal_angular_gaussian_splatting,ICCV_2025_A018_7dgsUnifiedSpatial,7DGS: Unified Spatial-Temporal-Angular Gaussian Splatting,ICCV,2025,ICCV_2025,Zhongpai Gao; Benjamin Planche; Meng Zheng; Anwesa Choudhuri; Terrence Chen; Ziyan Wu,"Real-time rendering of dynamic scenes with view-dependent effects remains a fundamental challenge in computer graphics. While recent advances in Gaussian Splatting have shown promising results separately handling dynamic scenes (4DGS) and view-dependent effects (6DGS), no existing method unifies these capabilities while maintaining real-time performance. We present 7D Gaussian Splatting (7DGS), a unified framework representing scene elements as seven-dimensional Gaussians spanning position (3D), time (1D), and viewing direction (3D). Our key contribution is an efficient conditional slicing mechanism that transforms 7D Gaussians into view- and time-conditioned 3D Gaussians, maintaining compatibility with existing 3D Gaussian Splatting pipelines while enabling joint optimization. Experiments demonstrate that 7DGS outperforms prior methods by up to 7.36 dB in PSNR while achieving real-time rendering (401 FPS) on challenging dynamic scenes with complex view-dependent effects. The project page is: https://gaozhongpai.github.io/7dgs/.",https://openaccess.thecvf.com/content/ICCV2025/papers/Gao_7DGS_Unified_Spatial-Temporal-Angular_Gaussian_Splatting_ICCV_2025_paper.pdf,2503.07946,https://arxiv.org/abs/2503.07946,,cvpr_openaccess_html,https://openaccess.thecvf.com/ICCV2025?day=all,,true,Wait,keyword,1,0.0,A,"Extends 4DGS by unifying spatial-temporal-angular dimensions, rendering-focused.",,,A,A,,,,,1,1,https://arxiv.org/pdf/2503.07946.pdf,,,,,
ICCV_2025::degauss_dynamic_static_decomposition_with_gaussian_splatting_for_distractor_free_3d_reconstruction,ICCV_2025_A525_DegaussDynamicStatic,DeGauss: Dynamic-Static Decomposition with Gaussian Splatting for Distractor-free 3D Reconstruction,ICCV,2025,ICCV_2025,Rui Wang; Quentin Lohmeyer; Mirko Meboldt; Siyu Tang,"Reconstructing clean, distractor-free 3D scenes from real-world captures remains a significant challenge, particularly in highly dynamic and cluttered settings such as egocentric videos. To tackle this problem, we introduce DeGauss, a simple and robust self-supervised framework for dynamic scene reconstruction based on a decoupled dynamic-static Gaussian Splatting design. DeGauss models dynamic elements with foreground Gaussians and static content with background Gaussians, using a probabilistic mask to coordinate their composition and enable independent yet complementary optimization. DeGauss generalizes robustly across a wide range of real-world scenarios, from casual image collections to long, dynamic egocentric videos, without relying on complex heuristics or extensive supervision. Experiments on benchmarks including NeRF-on-the-go, ADT, AEA, Hot3D, and EPIC-Fields demonstrate that DeGauss consistently outperforms existing methods, establishing a strong baseline for generalizable, distractor-free 3D reconstructionin highly dynamic, interaction-rich environments. Project page: https://batfacewayne.github.io/DeGauss.io/",https://openaccess.thecvf.com/content/ICCV2025/papers/Wang_DeGauss_Dynamic-Static_Decomposition_with_Gaussian_Splatting_for_Distractor-free_3D_Reconstruction_ICCV_2025_paper.pdf,2503.13176,https://arxiv.org/abs/2503.13176,,cvpr_openaccess_html,https://openaccess.thecvf.com/ICCV2025?day=all,,true,Wait,embedding,0,0.8253716230392456,A,"Dynamic-static decomposition with GS, relevant for editing infrastructure.",,,A,A,,,,,1,1,https://arxiv.org/pdf/2503.13176.pdf,,,,,
ICCV_2025::emd_explicit_motion_modeling_for_high_quality_street_gaussian_splatting,ICCV_2025_A728_EmdExplicitMotion,EMD: Explicit Motion Modeling for High-Quality Street Gaussian Splatting,ICCV,2025,ICCV_2025,Xiaobao Wei; Qingpo Wuwu; Zhongyu Zhao; Zhuangzhe Wu; Nan Huang; Ming Lu; Ningning Ma; Shanghang Zhang,"Photorealistic reconstruction of street scenes is essential for developing real-world simulators in autonomous driving. While recent methods based on 3D/4D Gaussian Splatting (GS) have demonstrated promising results, they still encounter challenges in complex street scenes due to the unpredictable motion of dynamic objects. Current methods typically decompose street scenes into static and dynamic objects, learning the Gaussians in either a supervised manner (e.g., w/ 3D bounding-box) or a self-supervised manner (e.g., w/o 3D bounding-box). However, these approaches do not effectively model the motions of dynamic objects (e.g., the motion speed of pedestrians is clearly different from that of vehicles), resulting in suboptimal scene decomposition. To address this, we propose Explicit Motion Decomposition (EMD), which models the motions of dynamic objects by introducing learnable motion embeddings to the Gaussians, enhancing the decomposition in street scenes. The proposed plug-and-play EMD module compensates for the lack of motion modeling in self-supervised street Gaussian splatting methods. We also introduce tailored training strategies to extend EMD to supervised approaches. Comprehensive experiments demonstrate the effectiveness of our method, achieving state-of-the-art novel view synthesis performance in self-supervised settings. The code is available at: https://qingpowuwu.github.io/emd.",https://openaccess.thecvf.com/content/ICCV2025/papers/Wei_EMD_Explicit_Motion_Modeling_for_High-Quality_Street_Gaussian_Splatting_ICCV_2025_paper.pdf,2411.15582,https://arxiv.org/abs/2411.15582,,cvpr_openaccess_html,https://openaccess.thecvf.com/ICCV2025?day=all,,true,Wait,keyword,1,0.0,A,"4DGS for dynamic street scenes with explicit motion, reconstruction-focused.",,,A,A,,,,,1,1,https://arxiv.org/pdf/2411.15582.pdf,,,,,
ICCV_2025::gaussianupdate_continual_3d_gaussian_splatting_update_for_changing_environments,ICCV_2025_A976_GaussianupdateContinual3d,GaussianUpdate: Continual 3D Gaussian Splatting Update for Changing Environments,ICCV,2025,ICCV_2025,Lin Zeng; Boming Zhao; Jiarui Hu; Xujie Shen; Ziqiang Dang; Hujun Bao; Zhaopeng Cui,"Novel view synthesis with neural models has advanced rapidly in recent years, yet adapting these models to scene changes remains an open problem. Existing methods are either labor-intensive, requiring extensive model retraining, or fail to capture detailed types of changes over time. In this paper, we present GaussianUpdate, a novel approach that combines 3D Gaussian representation with continual learning to address these challenges. Our method effectively updates the Gaussian radiance fields with current data while preserving information from past scenes. Unlike existing methods, GaussianUpdate explicitly models different types of changes through a novel multi-stage update strategy. Additionally, we introduce a visibility-aware continual learning approach with generative replay, enabling self-aware updating without the need to store images. The experiments on the benchmark dataset demonstrate our method achieves superior and real-time rendering with the capability of visualizing changes over different times",https://openaccess.thecvf.com/content/ICCV2025/papers/Zeng_GaussianUpdate_Continual_3D_Gaussian_Splatting_Update_for_Changing_Environments_ICCV_2025_paper.pdf,2508.08867,https://arxiv.org/abs/2508.08867,,cvpr_openaccess_html,https://openaccess.thecvf.com/ICCV2025?day=all,,true,Wait,embedding,0,0.811989426612854,A,Continual 3DGS update for changing environments.,,,A,A,,,,,1,1,https://arxiv.org/pdf/2508.08867.pdf,,,,,
ICCV_2025::localdygs_multi_view_global_dynamic_scene_modeling_via_adaptive_local_implicit_feature_decoupling,ICCV_2025_A1412_LocaldygsMultiView,LocalDyGS: Multi-view Global Dynamic Scene Modeling via Adaptive Local Implicit Feature Decoupling,ICCV,2025,ICCV_2025,Jiahao Wu; Rui Peng; Jianbo Jiao; Jiayu Yang; Luyang Tang; Kaiqiang Xiong; Jie Liang; Jinbo Yan; Runling Liu; Ronggang Wang,"Due to the complex and highly dynamic motions in the real world, synthesizing dynamic videos from multi-view inputs for arbitrary viewpoints is challenging. Previous works based on neural radiance field or 3D Gaussian splatting are limited to modeling fine-scale motion, greatly restricting their application. In this paper, we introduce LocalDyGS, which consists of two parts to adapt our method to both large-scale and fine-scale motion scenes: 1) We decompose a complex dynamic scene into streamlined local spaces defined by seeds, enabling global modeling by capturing motion within each local space. 2) We decouple static and dynamic features for local space motion modeling. A static feature shared across time steps captures static information, while a dynamic residual field provides time-specific features. These are combined and decoded to generate Temporal Gaussians, modeling motion within each local space. As a result, we propose a novel dynamic scene reconstruction framework to model highly dynamic real-world scenes more realistically. Our method not only demonstrates competitive performance on various fine-scale datasets compared to state-of-the-art (SOTA) methods, but also represents the first attempt to model larger and more complex highly dynamic scenes. Project page: https://wujh2001.github.io/LocalDyGS/.",https://openaccess.thecvf.com/content/ICCV2025/papers/Wu_LocalDyGS_Multi-view_Global_Dynamic_Scene_Modeling_via_Adaptive_Local_Implicit_ICCV_2025_paper.pdf,2507.02363,https://arxiv.org/abs/2507.02363,,cvpr_openaccess_html,https://openaccess.thecvf.com/ICCV2025?day=all,,true,Wait,keyword,1,0.0,A,"Dynamic GS for multi-view dynamic scene modeling, core 4DGS method.",,,A,A,,,,,1,1,https://arxiv.org/pdf/2507.02363.pdf,,,,,
ICCV_2025::mega_memory_efficient_4d_gaussian_splatting_for_dynamic_scenes,ICCV_2025_A1491_MegaMemoryEfficient,MEGA: Memory-Efficient 4D Gaussian Splatting for Dynamic Scenes,ICCV,2025,ICCV_2025,Xinjie Zhang; Zhening Liu; Yifan Zhang; Xingtong Ge; Dailan He; Tongda Xu; Yan Wang; Zehong Lin; Shuicheng Yan; Jun Zhang,"4D Gaussian Splatting (4DGS) has recently emerged as a promising technique for capturing complex dynamic 3D scenes with high fidelity. It utilizes a 4D Gaussian representation and a GPU-friendly rasterizer, enabling rapid rendering speeds. Despite its advantages, 4DGS faces significant challenges, notably the requirement of millions of 4D Gaussians, each with extensive associated attributes, leading to substantial memory and storage cost. This paper introduces a memory-efficient framework for 4DGS. We streamline the color attribute by decomposing it into a per-Gaussian direct color component with only 3 parameters and a shared lightweight alternating current color predictor. This approach eliminates the need for spherical harmonics coefficients, which typically involve up to 144 parameters in classic 4DGS, thereby creating a memory-efficient 4D Gaussian representation. Furthermore, we introduce an entropy-constrained Gaussian deformation technique that uses a deformation field to expand the action range of each Gaussian and integrates an opacity-based entropy loss to limit the number of Gaussians, thus forcing our model to use as few Gaussians as possible to fit a dynamic scene well. With simple half-precision storage and zip compression, our framework achieves a storage reduction by approximately 190$\times$ and 125$\times$ on the Technicolor and Neural 3D Video datasets, respectively, compared to the original 4DGS. Meanwhile, it maintains comparable rendering speeds and scene representation quality, setting a new standard in the field. Code is available at https://github.com/Xinjie-Q/MEGA.",https://openaccess.thecvf.com/content/ICCV2025/papers/Zhang_MEGA_Memory-Efficient_4D_Gaussian_Splatting_for_Dynamic_Scenes_ICCV_2025_paper.pdf,2410.13613,https://arxiv.org/abs/2410.13613,,cvpr_openaccess_html,https://openaccess.thecvf.com/ICCV2025?day=all,,true,Wait,keyword,2,0.0,A,"Memory-efficient 4DGS for dynamic scenes, methodological overlap.",,,A,A,,,,,1,1,https://arxiv.org/pdf/2410.13613.pdf,,,,,
ICLR_2025::dynamic_gaussians_mesh_consistent_mesh_reconstruction_from_dynamic_scenes,ICLR_2025_A3282_DynamicGaussiansMesh,Dynamic Gaussians Mesh: Consistent Mesh Reconstruction from Dynamic Scenes,ICLR,2025,ICLR_2025,Isabella Liu; Hao Su; Xiaolong Wang,"Modern 3D engines and graphics pipelines require mesh as a memory-efficient representation, which allows efficient rendering, geometry processing, texture editing, and many other downstream operations. However, it is still highly difficult to obtain high-quality mesh in terms of detailed structure and time consistency from dynamic observations. To this end, we introduce Dynamic Gaussians Mesh (DG-Mesh), a framework to reconstruct a high-fidelity and time-consistent mesh from dynamic input. Our work leverages the recent advancement in 3D Gaussian Splatting to construct the mesh sequence with temporal consistency from dynamic observations. Building on top of this representation, DG-Mesh recovers high-quality meshes from the Gaussian points and can track the mesh vertices over time, which enables applications such as texture editing on dynamic objects. We introduce the Gaussian-Mesh Anchoring, which encourages evenly distributed Gaussians, resulting better mesh reconstruction through mesh-guided densification and pruning on the deformed Gaussians. By applying cycle-consistent deformation between the canonical and the deformed space, we can project the anchored Gaussian back to the canonical space and optimize Gaussians across all time frames. During the evaluation on different datasets, DG-Mesh provides significantly better mesh reconstruction and rendering than baselines.",https://iclr.cc/virtual/2025/poster/29972,,,,virtual_conference_json,https://iclr.cc/static/virtual/data/iclr-2025-orals-posters.json,,,Wait,embedding,0,0.8166821599006653,A,"Dynamic Gaussians with mesh output, reconstruction not editing.",,,A,A,,,,,1,0,,,,,,
ICLR_2025::swift4d_adaptive_divide_and_conquer_gaussian_splatting_for_compact_and_efficient_reconstruction_of_dynamic_scene,ICLR_2025_A5593_Swift4dAdaptiveDivide,Swift4D: Adaptive divide-and-conquer Gaussian Splatting for compact and efficient reconstruction of dynamic scene,ICLR,2025,ICLR_2025,Jiahao Wu; Rui Peng; Zhiyan Wang; Lu Xiao; Luyang Tang; Jinbo Yan; Kaiqiang Xiong; Ronggang Wang,"Novel view synthesis has long been a practical but challenging task, although the introduction of numerous methods to solve this problem, even combining advanced representations like 3D Gaussian Splatting, they still struggle to recover high-quality results and often consume too much storage memory and training time. In this paper we propose Swift4D, a divide-and-conquer 3D Gaussian Splatting method that can handle static and dynamic primitives separately, achieving a good trade-off between rendering quality and efficiency, motivated by the fact that most of the scene is the static primitive and does not require additional dynamic properties. Concretely, we focus on modeling dynamic transformations only for the dynamic primitives which benefits both efficiency and quality. We first employ a learnable decomposition strategy to separate the primitives, which relies on an additional parameter to classify primitives as static or dynamic. For the dynamic primitives, we employ a compact multi-resolution 4D Hash mapper to transform these primitives from canonical space into deformation space at each timestamp, and then mix the static and dynamic primitives to produce the final output. This divide-and-conquer method facilitates efficient training and reduces storage redundancy. Our method not only achieves state-of-the-art rendering quality while being 20× faster in training than previous SOTA methods with a minimum storage requirement of only 30MB on real-world datasets.",https://iclr.cc/virtual/2025/poster/29075,,,,virtual_conference_json,https://iclr.cc/static/virtual/data/iclr-2025-orals-posters.json,,,Wait,embedding,0,0.8150997757911682,A,4DGS for compact/efficient dynamic reconstruction.,,,A,A,,,,,1,0,,,,,,
ICML_2024::superpoint_gaussian_splatting_for_real_time_high_fidelity_dynamic_scene_reconstruction,ICML_2024_A2334_SuperpointGaussianSplatting,Superpoint Gaussian Splatting for Real-Time High-Fidelity Dynamic Scene Reconstruction,ICML,2024,ICML_2024,Diwen Wan; Ruijie Lu; Gang Zeng,"Rendering novel view images in dynamic scenes is a crucial yet challenging task. Current methods mainly utilize NeRF-based methods to represent the static scene and an additional time-variant MLP to model scene deformations, resulting in relatively low rendering quality as well as slow inference speed. To tackle these challenges, we propose a novel framework named Superpoint Gaussian Splatting (SP-GS). Specifically, our framework first employs explicit 3D Gaussians to reconstruct the scene and then clusters Gaussians with similar properties (e.g., rotation, translation, and location) into superpoints. Empowered by these superpoints, our method manages to extend 3D Gaussian splatting to dynamic scenes with only a slight increase in computational expense. Apart from achieving state-of-the-art visual quality and real-time rendering under high resolutions, the superpoint representation provides a stronger manipulation capability. Extensive experiments demonstrate the practicality and effectiveness of our approach on both synthetic and real-world datasets. Please see our project page at https://dnvtmf.github.io/SP_GS.github.io.",https://proceedings.mlr.press/v235/wan24f.html,,,,virtual_conference_json,https://icml.cc/static/virtual/data/icml-2024-orals-posters.json,,true,Wait,embedding,0,0.8362103700637817,A,"4D scene generation with video diffusion, relevant 4D content creation.",,,A,A,,,,,1,0,,,,,,
NeurIPS_2024::4d_gaussian_splatting_in_the_wild_with_uncertainty_aware_regularization,NEURIPS_2024_A014_4dGaussianSplatting,4D Gaussian Splatting in the Wild with Uncertainty-Aware Regularization,NeurIPS,2024,NeurIPS_2024,Mijeong Kim; Jongwoo Lim; Bohyung Han,"Novel view synthesis of dynamic scenes is becoming important in various applications, including augmented and virtual reality.We propose a novel 4D Gaussian Splatting (4DGS) algorithm for dynamic scenes from casually recorded monocular videos. To overcome the overfitting problem of existing work for these real-world videos, we introduce an uncertainty-aware regularization that identifies uncertain regions with few observations and selectively imposes additional priors based on diffusion models and depth smoothness on such regions.This approach improves both the performance of novel view synthesis and the quality of training image reconstruction. We also identify the initialization problem of 4DGS in fast-moving dynamic regions, where the Structure from Motion (SfM) algorithm fails to provide reliable 3D landmarks. To initialize Gaussian primitives in such regions, we present a dynamic region densification method using the estimated depth maps and scene flow. Our experiments show that the proposed method improves the performance of 4DGS reconstruction from a video captured by a handheld monocular camera and also exhibits promising results in few-shot static scene reconstruction.",https://neurips.cc/virtual/2024/poster/96899,,,,virtual_conference_json,https://neurips.cc/static/virtual/data/neurips-2024-orals-posters.json,,,Wait,both,2,0.8212719559669495,A,4DGS with regularization for dynamic scenes. Significant overlap though focuses on novel view synthesis.,,,A,A,,,,,1,0,,,,,,
NeurIPS_2025::4d3r_motion_aware_neural_reconstruction_and_rendering_of_dynamic_scenes_from_monocular_videos,NEURIPS_2025_A4557_4d3rMotionAware,4D3R: Motion-Aware Neural Reconstruction and Rendering of Dynamic Scenes from Monocular Videos,NeurIPS,2025,NeurIPS_2025,Mengqi Guo; Bo Xu; Yanyan Li; Gim Hee Lee,"Novel view synthesis from monocular videos of dynamic scenes with unknown camera poses remains a fundamental challenge in computer vision and graphics. While recent advances in 3D representations such as Neural Radiance Fields (NeRF) and 3D Gaussian Splatting (3DGS) have shown promising results for static scenes, they struggle with dynamic content and typically rely on pre-computed camera poses. We present 4D3R, a pose-free dynamic neural rendering framework that decouples static and dynamic components through a two-stage approach. Our method first leverages 3D foundational models for initial pose and geometry estimation, followed by motion-aware refinement. 4D3R introduces two key technical innovations: (1) a motion-aware bundle adjustment (MA-BA) module that combines transformer-based learned priors with SAM2 for robust dynamic object segmentation, enabling more accurate camera pose refinement; and (2) an efficient Motion-Aware Gaussian Splatting (MA-GS) representation that uses control points with a deformation field MLP and linear blend skinning to model dynamic motion, significantly reducing computational cost while maintaining high-quality reconstruction. Extensive experiments on real-world dynamic datasets demonstrate that our approach achieves up to 1.8dB PSNR improvement over state-of-the-art methods, particularly in challenging scenarios with large dynamic objects, while reducing computational requirements by 5× compared to previous dynamic scene representations.",https://neurips.cc/virtual/2025/poster/119055,,,,virtual_conference_json,https://neurips.cc/static/virtual/data/neurips-2025-orals-posters.json,,,Wait,embedding,0,0.8216147422790527,A,4DGS for dynamic reconstruction from monocular video.,,,A,A,,,,,1,0,,,,,,
NeurIPS_2025::4dgt_learning_a_4d_gaussian_transformer_using_real_world_monocular_videos,NEURIPS_2025_A4559_4dgtLearningA,4DGT: Learning a 4D Gaussian Transformer Using Real-World Monocular Videos,NeurIPS,2025,NeurIPS_2025,Zhen Xu; Zhengqin Li; Zhao Dong; Xiaowei Zhou; Richard Newcombe; Zhaoyang Lv,"We propose 4DGT, a 4D Gaussian-based Transformer model for dynamic scene reconstruction, trained entirely on real-world monocular posed videos. Using 4D Gaussian as an inductive bias, 4DGT unifies static and dynamic components, enabling the modeling of complex, time-varying environments with varying object lifespans. We proposed a novel density control strategy in training, which enables our 4DGT to handle longer space-time input. Our model processes 64 consecutive posed frames in a rolling-window fashion, predicting consistent 4D Gaussians in the scene. Unlike optimization-based methods, 4DGT performs purely feed-forward inference, reducing reconstruction time from hours to seconds and scaling effectively to long video sequences. Trained only on large-scale monocular posed video datasets, 4DGT can outperform prior Gaussian-based networks significantly in real-world videos and achieve on-par accuracy with optimization-based methods on cross-domain videos.",https://neurips.cc/virtual/2025/poster/115879,,,,virtual_conference_json,https://neurips.cc/static/virtual/data/neurips-2025-orals-posters.json,,,Wait,embedding,0,0.8322903513908386,A,"4D Gaussian Transformer for dynamic reconstruction, relevant 4DGS technique.",,,A,A,,,,,1,0,,,,,,
NeurIPS_2025::dgs_lrm_real_time_deformable_3d_gaussian_reconstruction_from_monocular_videos,NEURIPS_2025_A5748_DgsLrmReal,DGS-LRM: Real-Time Deformable 3D Gaussian Reconstruction From Monocular Videos,NeurIPS,2025,NeurIPS_2025,Chieh Lin; Zhaoyang Lv; Songyin Wu; Zhen Xu; Thu Nguyen-Phuoc; Hung-Yu Tseng; Julian Straub; Numair Khan; Lei Xiao; Ming-Hsuan Yang; Yuheng Ren; Richard Newcombe; Zhao Dong; Zhengqin Li,"We introduce the Deformable Gaussian Splats Large Reconstruction Model (DGS-LRM), the first feed-forward method predicting deformable 3D Gaussian splats from a monocular posed video of any dynamic scene. Feed-forward scene reconstruction has gained significant attention for its ability to rapidly create digital replicas of real-world environments. However, most existing models are limited to static scenes and fail to reconstruct the motion of moving objects. Developing a feed-forward model for dynamic scene reconstruction poses significant challenges, including the scarcity of training data and the need for appropriate 3D representations and training paradigms. To address these challenges, we introduce several key technical contributions: an enhanced large-scale synthetic dataset with ground-truth multi-view videos and dense 3D scene flow supervision; a per-pixel deformable 3D Gaussian representation that is easy to learn, supports high-quality dynamic view synthesis, and enables long-range 3D tracking; and a large transformer network that achieves real-time, generalizable dynamic scene reconstruction. Extensive qualitative and quantitative experiments demonstrate that DGS-LRM achieves dynamic scene reconstruction quality comparable to optimization-based methods, while significantly outperforming the state-of-the-art predictive dynamic reconstruction method on real-world examples. Its predicted physically grounded 3D deformation is accurate and can be readily adapted for long-range 3D tracking tasks, achieving performance on par with state-of-the-art monocular video 3D tracking methods.",https://neurips.cc/virtual/2025/poster/117552,,,,virtual_conference_json,https://neurips.cc/static/virtual/data/neurips-2025-orals-posters.json,,,Wait,embedding,0,0.8194441199302673,A,"Deformable GS reconstruction from monocular video, feed-forward method.",,,A,A,,,,,1,0,,,,,,
