paper_id,short_id,title,venue,year,conf_year,authors,abstract_raw,paper_link,arxiv_id,arxiv_url,keywords_raw,source_type,source_url,openreview_forum_id,has_pdf_camera_ready,state,filter_source,keyword_hits,embedding_score,ai_score,ai_reason,review_adjusted,review_adjust_reason,final_score,importance,core_or_edge,tags,topic_bucket,pdf_path,has_abstract,has_pdf_link,pdf_url,openreview_rating_mean,openreview_confidence_mean,openreview_decision,presentation_type,citation_count
CVPR_2025::gifstream_4d_gaussian_based_immersive_video_with_feature_stream,CVPR_2025_A3815_Gifstream4dGaussian,GIFStream: 4D Gaussian-based Immersive Video with Feature Stream,CVPR,2025,CVPR_2025,Hao Li; Sicheng Li; Xiang Gao; Abudouaihati Batuer; Lu Yu; Yiyi Liao,"Immersive video offers a 6-Dof-Free viewing experience, potentially playing a key role in future video technology. Recently, 4D Gaussian Splatting has gained attention as an effective approach for immersive video due to its high rendering efficiency and quality, though maintaining quality with manageable storage remains challenging. To address this, we introduce GIFStream, a novel 4D Gaussian representation using a canonical space and a deformation field enhanced with time-dependent feature streams. These feature streams enable complex motion modeling and allow efficient compression by leveraging their motion-awareness and temporal correspondence. Additionally, we incorporate both temporal and spatial compression networks for end-to-end compression. Experimental results show that GIFStream delivers high-quality immersive video at 30 Mbps, with real-time rendering and fast decoding on an RTX 4090.",https://openaccess.thecvf.com/content/CVPR2025/papers/Li_GIFStream_4D_Gaussian-based_Immersive_Video_with_Feature_Stream_CVPR_2025_paper.pdf,2505.07539,https://arxiv.org/abs/2505.07539,,cvpr_openaccess_html,fixture://cvpr_2025_openaccess.html,,true,Wait,keyword,1,0.0,A,"4DGS for immersive video, relevant 4DGS method but not editing.",,,A,A,,,,,1,1,https://arxiv.org/pdf/2505.07539.pdf,,,,,
CVPR_2025::himor_monocular_deformable_gaussian_reconstruction_with_hierarchical_motion_representation,CVPR_2025_A3901_HimorMonocularDeformable,HiMoR: Monocular Deformable Gaussian Reconstruction with Hierarchical Motion Representation,CVPR,2025,CVPR_2025,Yiming Liang; Tianhan Xu; Yuta Kikuchi,"We present Hierarchical Motion Representation (HiMoR), a novel deformation representation for 3D Gaussian primitives capable of achieving high-quality monocular dynamic 3D reconstruction. The insight behind HiMoR is that motions in everyday scenes can be decomposed into coarser motions that serve as the foundation for finer details. Using a tree structure, HiMoR’s nodes represent different levels of motion detail, with shallower nodes modeling coarse motion for temporal smoothness and deeper nodes capturing finer motion. Additionally, our model uses a few shared motion bases to represent motions of different sets of nodes, aligning with the assumption that motion tends to be smooth and simple. This motion representation design provides Gaussians with a more structured deformation, maximizing the use of temporal relationships to tackle the challenging task of monocular dynamic 3D reconstruction. We also propose using a more reliable perceptual metric as an alternative, given that pixel-level metrics for evaluating monocular dynamic 3D reconstruction can sometimes fail to accurately reflect the true quality of reconstruction. Extensive experiments demonstrate our method’s efficacy in achieving superior novel view synthesis from challenging monocular videos with complex motions.",https://openaccess.thecvf.com/content/CVPR2025/papers/Liang_HiMoR_Monocular_Deformable_Gaussian_Reconstruction_with_Hierarchical_Motion_Representation_CVPR_2025_paper.pdf,2504.06210,https://arxiv.org/abs/2504.06210,,cvpr_openaccess_html,fixture://cvpr_2025_openaccess.html,,true,Wait,keyword,1,0.0,A,"Deformable GS for dynamic reconstruction with hierarchical motion, core 4DGS method.",,,A,A,,,,,1,1,https://arxiv.org/pdf/2504.06210.pdf,,,,,
CVPR_2025::ntr_gaussian_nighttime_dynamic_thermal_reconstruction_with_4d_gaussian_splatting_based_on_thermodynamics,CVPR_2025_A4484_NtrGaussianNighttime,NTR-Gaussian: Nighttime Dynamic Thermal Reconstruction with 4D Gaussian Splatting Based on Thermodynamics,CVPR,2025,CVPR_2025,Kun Yang; Yuxiang Liu; Zeyu Cui; Yu Liu; Maojun Zhang; Shen Yan; Qing Wang,"Thermal infrared imaging enables a non-invasive measurement of the surface temperature of objects with all-weather applicability. Leveraging such techniques for 3D reconstruction can accurately reflect the temperature distribution of a scene, thereby supporting applications such as building monitoring and energy management. However, existing approaches predominantly focus on static 3D reconstruction for a single time period, overlooking the dynamic nature of thermal radiation phenomena, and failing to predict or analyze temperature variations over time. In this paper, we introduce a novel method, termed NTR-Gaussian, grounded in thermodynamics to address the challenge of nighttime dynamic thermal reconstruction using 4D Gaussian Splatting. Specifically, We utilize neural networks to predict thermodynamic parameters, such as emissivity, convective heat transfer coefficient, and heat capacity, etc. By means of integration, we numerically solve the infrared temperature of the scene at each moment during the night, so as to predict the temperature of the nighttime scene more accurately. To further advance research in this domain, we release a comprehensive dataset of dynamic thermal reconstruction spanning four distinct regions. Extensive experiments demonstrate that NTR-Gaussian significantly outperforms comparison methods in thermal reconstruction, achieving a predicted temperature error within 1 degree Celsius.",https://openaccess.thecvf.com/content/CVPR2025/papers/Yang_NTR-Gaussian_Nighttime_Dynamic_Thermal_Reconstruction_with_4D_Gaussian_Splatting_Based_CVPR_2025_paper.pdf,,,,cvpr_openaccess_html,fixture://cvpr_2025_openaccess.html,,true,Wait,keyword,1,0.0,A,"4DGS for dynamic thermal reconstruction, core 4DGS method.",,,A,A,,,,,1,1,https://openaccess.thecvf.com/content/CVPR2025/papers/Yang_NTR-Gaussian_Nighttime_Dynamic_Thermal_Reconstruction_with_4D_Gaussian_Splatting_Based_CVPR_2025_paper.pdf,,,,,
CVPR_2025::robust_multi_object_4d_generation_for_in_the_wild_videos,CVPR_2025_A4872_RobustMultiObject,Robust Multi-Object 4D Generation for In-the-wild Videos,CVPR,2025,CVPR_2025,Wen-Hsuan Chu; Lei Ke; Jianmeng Liu; Mingxiao Huo; Pavel Tokmakov; Katerina Fragkiadaki,"We address the challenge of generating dynamic 4D scenes from monocular multi-object videos with heavy occlusions and introduce Robust4DGen, a novel approach that integrates rendering-based deformable 3D Gaussian optimization with generative priors for view synthesis. While existing view-synthesis models excel at novel view generation for isolated objects, they struggle with full scenes due to their complexity and data demands. To overcome this, Robust4DGen decomposes scenes into individual objects, optimizing a differentiable set of deformable Gaussians per object while capturing 2D occlusions from a 3D perspective through joint Gaussian splatting. Joint splatting ensures occlusion-aware rendering losses in observed frames while explicit object decomposition allows the usage of object-centric diffusion models for object completion in unobserved viewpoints. To reconcile the differences between object-centric priors and the global frame-centric coordinate system of the video, Robust4DGen employs differentiable transformations to unify the rendering and generative constraints within a single framework. The result is a model capable of generating 4D objects across space and time while producing 2D and 3D point tracks from monocular videos. To rigorously evaluate the quality of scene generation and the accuracy of the motion under multi-object occlusions, we introduce MOSE-PTS, a subset of the challenging MOSE benchmark, which we annotated with high-quality 2D point tracks. Quantitative evaluations and perceptual human studies confirm that Robust4DGen generates more realistic novel views of scenes and produces more accurate point tracks compared to existing approaches.",https://openaccess.thecvf.com/content/CVPR2025/papers/Chu_Robust_Multi-Object_4D_Generation_for_In-the-wild_Videos_CVPR_2025_paper.pdf,,,,cvpr_openaccess_html,fixture://cvpr_2025_openaccess.html,,true,Wait,keyword,1,0.0,A,"Deformable 4DGS for dynamic scene generation from video, relevant 4DGS technique.",,,A,A,,,,,1,1,https://openaccess.thecvf.com/content/CVPR2025/papers/Chu_Robust_Multi-Object_4D_Generation_for_In-the-wild_Videos_CVPR_2025_paper.pdf,,,,,
CVPR_2024::spacetime_gaussian_feature_splatting_for_real_time_dynamic_view_synthesis,CVPR_2024_A2242_SpacetimeGaussianFeature,Spacetime Gaussian Feature Splatting for Real-Time Dynamic View Synthesis,CVPR,2024,CVPR_2024,Zhan Li; Zhang Chen; Zhong Li; Yi Xu,"Novel view synthesis of dynamic scenes has been an intriguing yet challenging problem. Despite recent advancements, simultaneously achieving high-resolution photorealistic results, real-time rendering, and compact storage remains a formidable task. To address these challenges, we propose Spacetime Gaussian Feature Splatting as a novel dynamic scene representation, composed of three pivotal components. First, we formulate expressive Spacetime Gaussians by enhancing 3D Gaussians with temporal opacity and parametric motion/rotation. This enables Space-time Gaussians to capture static, dynamic, as well as transient content within a scene. Second, we introduce splatted feature rendering, which replaces spherical harmonics with neural features. These features facilitate the modeling of view- and time-dependent appearance while maintaining small size. Third, we leverage the guidance of training error and coarse depth to sample new Gaussians in areas that are challenging to converge with existing pipelines. Experiments on several established real-world datasets demonstrate that our method achieves state-of-the-art rendering quality and speed, while retaining compact storage. At 8K resolution, our lite-version model can render at 60 FPS on an Nvidia RTX 4090 GPU.",https://openaccess.thecvf.com/content/CVPR2024/papers/Li_Spacetime_Gaussian_Feature_Splatting_for_Real-Time_Dynamic_View_Synthesis_CVPR_2024_paper.pdf,2312.16812,https://arxiv.org/abs/2312.16812,,cvpr_openaccess_html,https://openaccess.thecvf.com/CVPR2024?day=all,,true,Wait,both,1,0.8271191716194153,A,"Spacetime GS for dynamic view synthesis, core 4DGS method.",,,A,A,,,,,1,1,https://arxiv.org/pdf/2312.16812.pdf,,,,,
CVPR_2025::splatflow_self_supervised_dynamic_gaussian_splatting_in_neural_motion_flow_field_for_autonomous_driving,CVPR_2025_A5114_SplatflowSelfSupervised,SplatFlow: Self-Supervised Dynamic Gaussian Splatting in Neural Motion Flow Field for Autonomous Driving,CVPR,2025,CVPR_2025,Su Sun; Cheng Zhao; Zhuoyang Sun; Yingjie Victor Chen; Mei Chen,"Most existing Dynamic Gaussian Splatting methods for complex dynamic urban scenarios rely on accurate object-level supervision from expensive manual labeling, limiting their scalability in real-world applications. In this paper, we introduce SplatFlow, a Self-Supervised Dynamic Gaussian Splatting within Neural Motion Flow Fields (NMFF) to learn 4D space-time representations without requiring tracked 3D bounding boxes, enabling accurate dynamic scene reconstruction and novel view RGB/depth/flow synthesis. SplatFlow designs a unified framework to seamlessly integrate time-dependent 4D Gaussian representation within NMFF, where NMFF is a set of implicit functions to model temporal motions of both LiDAR points and Gaussians as continuous motion flow fields. Leveraging NMFF, SplatFlow effectively decomposes static background and dynamic objects, representing them with 3D and 4D Gaussian primitives, respectively. NMFF also models the correspondences of each 4D Gaussian across time, which aggregates temporal features to enhance cross-view consistency of dynamic components. SplatFlow further improves dynamic object identification by distilling features from 2D foundation models into 4D space-time representation. Comprehensive evaluations conducted on the Waymo and KITTI Datasets validate SplatFlow’s state-of-the-art (SOTA) performance for both image reconstruction and novel view synthesis in dynamic urban scenarios.",https://openaccess.thecvf.com/content/CVPR2025/papers/Sun_SplatFlow_Self-Supervised_Dynamic_Gaussian_Splatting_in_Neural_Motion_Flow_Field_CVPR_2025_paper.pdf,2411.15482,https://arxiv.org/abs/2411.15482,,cvpr_openaccess_html,fixture://cvpr_2025_openaccess.html,,true,Wait,embedding,0,0.8189191222190857,A,"Dynamic GS for autonomous driving, reconstruction-focused.",,,A,A,,,,,1,1,https://arxiv.org/pdf/2411.15482.pdf,,,,,
ECCV_2024::a_compact_dynamic_3d_gaussian_representation_for_real_time_dynamic_view_synthesis,ECCV_2024_A026_ACompactDynamic,A Compact Dynamic 3D Gaussian Representation for Real-Time Dynamic View Synthesis,ECCV,2024,ECCV_2024,Kai Katsumata; Duc Minh Vo; Hideki Nakayama,"3D Gaussian Splatting (3DGS) has shown remarkable success in synthesizing novel views given multiple views of a static scene. Yet, 3DGS faces challenges when applied to dynamic scenes because 3D Gaussian parameters need to be updated per timestep, requiring a large amount of memory and at least a dozen observations per timestep. To address these limitations, we present a compact dynamic 3D Gaussian representation that models positions and rotations as functions of time with a few parameter approximations while keeping other properties of 3DGS including scale, color and opacity invariant. Our method can dramatically reduce memory usage and relax a strict multi-view assumption. In our experiments on monocular and multi-view scenarios, we show that our method not only matches state-of-the-art methods, often linked with slower rendering speeds, in terms of high rendering quality but also significantly surpasses them by achieving a rendering speed of 118 frames per second (FPS) at a resolution of 1,352x1,014 on a single GPU.",https://www.ecva.net/papers/eccv_2024/papers_ECCV/papers/11720.pdf,,,,virtual_conference_json,https://eccv.ecva.net/static/virtual/data/eccv-2024-orals-posters.json,,true,Wait,embedding,0,0.8336557149887085,A,"Dynamic GS for few-shot reconstruction, view synthesis focused.",,,A,A,,,,,1,1,https://www.ecva.net/papers/eccv_2024/papers_ECCV/papers/11720.pdf,,,,,
ECCV_2024::dgd_dynamic_3d_gaussians_distillation,ECCV_2024_A479_DgdDynamic3d,DGD: Dynamic 3D Gaussians Distillation,ECCV,2024,ECCV_2024,Isaac Labe; Noam Issachar; Itai Lang; Sagie Benaim,"We tackle the task of learning dynamic 3D semantic radiance fields given a single monocular video as input. Our learned semantic radiance field captures per-point semantics as well as color and geometric properties for a dynamic 3D scene, enabling the generation of novel views and their corresponding semantics. This enables the segmentation and tracking of a diverse set of 3D semantic entities, specified using a simple and intuitive interface that includes a user click or a text prompt. To this end, we present DGD, a unified 3D representation for both the appearance and semantics of a dynamic 3D scene, building upon the recently proposed dynamic 3D Gaussians representation. Our representation is optimized over time with both color and semantic information. Key to our method is the joint optimization of the appearance and semantic attributes, which jointly affect the geometric properties of the scene. We evaluate our approach in its ability to enable dense semantic 3D object tracking and demonstrate high-quality results that are fast to render, for a diverse set of scenes. Our code will be made available upon acceptance.",https://www.ecva.net/papers/eccv_2024/papers_ECCV/papers/08614.pdf,,,,virtual_conference_json,https://eccv.ecva.net/static/virtual/data/eccv-2024-orals-posters.json,,true,Wait,embedding,0,0.8273073434829712,A,"Dynamic 3D Gaussians with semantic distillation, relevant 4DGS approach.",,,A,A,,,,,1,1,https://www.ecva.net/papers/eccv_2024/papers_ECCV/papers/08614.pdf,,,,,
ECCV_2024::per_gaussian_embedding_based_deformation_for_deformable_3d_gaussian_splatting,ECCV_2024_A1572_PerGaussianEmbedding,Per-Gaussian Embedding-Based Deformation for Deformable 3D Gaussian Splatting,ECCV,2024,ECCV_2024,Jeongmin Bae; Seoha Kim; Youngsik Yun; Hahyun Lee; Gun Bang; Youngjung Uh,"As 3D Gaussian Splatting (3DGS) provides fast and high-quality novel view synthesis, it is a natural extension to deform a canonical 3DGS to multiple frames. However, we find that previous works fail to accurately reconstruct dynamic scenes, especially 1) static parts moving along nearby dynamic parts, and 2) some motions are blurry. We attribute the failure to the wrong design of the deformation field which is built as a coordinate-based function despite 3DGS is a mixture of multiple fields centered at the Gaussians. Furthermore, the previous methods consider only single-resolution temporal embeddings. To this end, we define the deformation as a function of per-Gaussian embeddings \textit{and} temporal embeddings. Moreover, we decompose deformation as coarse and fine deformations to model slow and fast movements, respectively. Last but not least, we introduce a training strategy for faster convergence and higher quality. Code will be available online.",https://www.ecva.net/papers/eccv_2024/papers_ECCV/papers/02361.pdf,,,,virtual_conference_json,https://eccv.ecva.net/static/virtual/data/eccv-2024-orals-posters.json,,true,Wait,embedding,0,0.8198323249816895,A,"Per-Gaussian deformation for deformable 3DGS, core deformation technique.",,,A,A,,,,,1,1,https://www.ecva.net/papers/eccv_2024/papers_ECCV/papers/02361.pdf,,,,,
ECCV_2024::stag4d_spatial_temporal_anchored_generative_4d_gaussians,ECCV_2024_A2017_Stag4dSpatialTemporal,STAG4D: Spatial-Temporal Anchored Generative 4D Gaussians,ECCV,2024,ECCV_2024,Yifei Zeng; Yanqin Jiang; Siyu Zhu; Yuanxun Lu; Youtian Lin; Hao Zhu; Weiming Hu; Xun Cao; Yao Yao,"Recent progress in pre-trained diffusion models and 3D generation have spurred interest in 4D content creation. However, achieving high-fidelity 4D generation with spatial-temporal consistency remains a challenge. In this work, we propose STAG4D, a novel framework that combines pre-trained diffusion models with dynamic 3D Gaussian splatting for high-fidelity 4D generation. Drawing inspiration from 3D generation techniques, we utilize a multi-view diffusion model to initialize multi-view images for each frame by anchoring on the corresponding input frame, where the video can be either real-world captured or generated by a video diffusion model. To ensure the temporal consistency of the multi-view sequence initialization, we introduce a simple yet effective fusion strategy to leverage the first frame as a temporal anchor in the cross-frame attention computation. With the almost consistent multi-view sequences, we then apply the score distillation sampling to optimize the 4D Gaussian point cloud. The 4D Gaussian spatting is specially crafted for the generation task, where an adaptive densification strategy is proposed to mitigate the unstable Gaussian gradient for robust optimization. Notably, the proposed pipeline does not require any pre-training or fine-tuning of diffusion networks, offering a more accessible and practical solution for the 4D generation task. Extensive experiments demonstrate that our method outperforms prior 4D generation works in rendering quality, spatial-temporal consistency, and generation robustness, setting a new state-of-the-art for 4D generation from diverse inputs, including text, image, and video.",https://www.ecva.net/papers/eccv_2024/papers_ECCV/papers/05288.pdf,,,,virtual_conference_json,https://eccv.ecva.net/static/virtual/data/eccv-2024-orals-posters.json,,true,Wait,embedding,0,0.8119196891784668,A,"4DGS for dynamic scene generation, relevant 4DGS technique.",,,A,A,,,,,1,1,https://www.ecva.net/papers/eccv_2024/papers_ECCV/papers/05288.pdf,,,,,
ECCV_2024::swings_sliding_windows_for_dynamic_3d_gaussian_splatting,ECCV_2024_A2052_SwingsSlidingWindows,SWinGS: Sliding Windows for Dynamic 3D Gaussian Splatting,ECCV,2024,ECCV_2024,Richard Shaw; Michal Nazarczuk; Song Jifei; Arthur Moreau; Sibi Catley-Chandar; Helisa Dhamo; Eduardo Pérez Pellitero,"Novel view synthesis has shown rapid progress recently, with methods capable of producing increasingly photorealistic results. 3D Gaussian Splatting has emerged as a promising method, producing high-quality renderings of scenes and enabling interactive viewing at real-time frame rates. However, it is limited to static scenes. In this work, we extend 3D Gaussian Splatting to reconstruct dynamic scenes. We model a scene's dynamics using dynamic MLPs, learning deformations from temporally-local canonical representations to per-frame 3D Gaussians. To disentangle static and dynamic regions, tuneable parameters weigh each Gaussian's respective MLP parameters, improving the dynamics modelling of imbalanced scenes. We introduce a sliding window training strategy that partitions the sequence into smaller manageable windows to handle arbitrary length scenes while maintaining high rendering quality. We propose an adaptive sampling strategy to determine appropriate window size hyperparameters based on the scene's motion, balancing training overhead with visual quality. Training a separate dynamic 3D Gaussian model for each sliding window allows the canonical representation to change, enabling the reconstruction of scenes with significant geometric changes. Temporal consistency is enforced using a fine-tuning step with self-supervising consistency loss on randomly sampled novel views. As a result, our method produces high-quality renderings of general dynamic scenes with competitive quantitative performance, which can be viewed in real-time in our dynamic interactive viewer.",https://www.ecva.net/papers/eccv_2024/papers_ECCV/papers/07170.pdf,,,,virtual_conference_json,https://eccv.ecva.net/static/virtual/data/eccv-2024-orals-posters.json,,true,Wait,embedding,0,0.8261964917182922,A,"Dynamic GS for novel view synthesis, core 4DGS method.",,,A,A,,,,,1,1,https://www.ecva.net/papers/eccv_2024/papers_ECCV/papers/07170.pdf,,,,,
ICCV_2025::4d_gaussian_splatting_slam,ICCV_2025_A014_4dGaussianSplatting,4D Gaussian Splatting SLAM,ICCV,2025,ICCV_2025,Yanyan Li; Youxu Fang; Zunjie Zhu; Kunyi Li; Yong Ding; Federico Tombari,"Simultaneously localizing camera poses and constructing Gaussian radiance fields in dynamic scenes establish a crucial bridge between 2D images and the 4D real world. Instead of removing dynamic objects as distractors and reconstructing only static environments, this paper proposes an efficient architecture that incrementally tracks camera poses and establishes the 4D Gaussian radiance fields in unknown scenarios by using a sequence of RGB-D images. First, by generating motion masks, we obtain static and dynamic priors for each pixel. To eliminate the influence of static scenes and improve the efficiency on learning the motion of dynamic objects, we classify the Gaussian primitives into static and dynamic Gaussian sets, while the sparse control points along with an MLP is utilized to model the transformation fields of the dynamic Gaussians. To more accurately learn the motion of dynamic Gaussians, a novel 2D optical flow map reconstruction algorithm is designed to render optical flows of dynamic objects between neighbor images, which are further used to supervise the 4D Gaussian radiance fields along with traditional photometric and geometric constraints. In experiments, qualitative and quantitative evaluation results show that the proposed method achieves robust tracking and high-quality view synthesis performance in real-world environments.",https://openaccess.thecvf.com/content/ICCV2025/papers/Li_4D_Gaussian_Splatting_SLAM_ICCV_2025_paper.pdf,2503.16710,https://arxiv.org/abs/2503.16710,,cvpr_openaccess_html,https://openaccess.thecvf.com/ICCV2025?day=all,,true,Wait,both,1,0.8159993290901184,A,"4DGS for SLAM, shares core 4DGS methodology but focuses on localization/mapping.",,,A,A,,,,,1,1,https://arxiv.org/pdf/2503.16710.pdf,,,,,
